{
  "$schema": "file:///docs/methodology/schema/v0.3.0.schema.json",
  "_source": {
    "changes": [
      "Semantic IDs (auth-oauth21 vs pr-3)",
      "Effort as ranges with confidence",
      "Tag canonicalization (20â†’12 tags)",
      "Removed type field (computed from tags)",
      "Evidence policy instead of pre-filled stubs",
      "Blocks with reasons vs depends_on lists",
      "Status with cause",
      "Sparse encoding (omit nulls)",
      "Structured gate predicates"
    ],
    "from_version": "0.2.1",
    "transformation_date": "2025-01-23",
    "transformation_version": "0.3.0"
  },
  "global_gates": [
    {
      "applies_to": "door:one_way",
      "approvers": [
        "SA"
      ],
      "checks": [
        {
          "description": "ADR present with decision rationale",
          "id": "risk-1",
          "predicate": {
            "expected": "non-null",
            "field": "adr_ref",
            "kind": "node-field-present",
            "target": "$node"
          }
        },
        {
          "description": "Rollback plan documented in ADR",
          "id": "risk-2",
          "predicate": {
            "kind": "adr-has-section",
            "section": "rollback-plan",
            "target": "$node"
          }
        },
        {
          "description": "Spike evidence validates decision",
          "id": "risk-3",
          "predicate": {
            "evidence_type": "spike",
            "kind": "evidence-meets",
            "result": "meets",
            "target": "$node"
          }
        }
      ],
      "id": "G-Risk",
      "outcomes": [
        "pass",
        "rollback"
      ],
      "purpose": "High-risk decision validation (applies to all one-way doors)"
    },
    {
      "applies_to": "door:operational",
      "approvers": [
        "DEV"
      ],
      "checks": [
        {
          "description": "SLO/SLI defined",
          "id": "ops-1",
          "predicate": {
            "artifact_type": "slo",
            "kind": "artifact-exists",
            "target": "$node"
          }
        },
        {
          "description": "Alert rules configured",
          "id": "ops-2",
          "predicate": {
            "artifact_type": "alert-rules",
            "kind": "artifact-exists",
            "target": "$node"
          }
        },
        {
          "description": "Runbook documented",
          "id": "ops-3",
          "predicate": {
            "evidence_type": "ops_runbook",
            "kind": "evidence-meets",
            "result": "meets",
            "target": "$node"
          }
        }
      ],
      "id": "G-Operate",
      "outcomes": [
        "pass",
        "fix_forward"
      ],
      "purpose": "Operational readiness validation (applies to all operational decisions)"
    }
  ],
  "levels": [
    {
      "description": "Essential for any MCP server",
      "id": "required",
      "label": "Required"
    },
    {
      "description": "Important for production deployments",
      "id": "recommended",
      "label": "Recommended"
    },
    {
      "description": "Nice to have for advanced use cases",
      "id": "optional",
      "label": "Optional"
    }
  ],
  "phases": [
    {
      "color": "#3B82F6",
      "description": "Initial setup and foundational decisions for your MCP server project",
      "gate": {
        "applies_to": "phase",
        "approvers": [
          "SA",
          "DEV"
        ],
        "checks": [
          {
            "description": "ADR present for naming pattern decision",
            "id": "gs-gate-1",
            "predicate": {
              "expected": "non-null",
              "field": "adr_ref",
              "kind": "node-field-present",
              "target": "server-naming"
            }
          },
          {
            "description": "ADR present for transport mechanism",
            "id": "gs-gate-2",
            "predicate": {
              "expected": "non-null",
              "field": "adr_ref",
              "kind": "node-field-present",
              "target": "transport-selection"
            }
          },
          {
            "description": "Transport spike validates choice",
            "id": "gs-gate-3",
            "predicate": {
              "evidence_type": "spike",
              "kind": "evidence-meets",
              "result": "meets",
              "target": "transport-selection"
            }
          },
          {
            "description": "All required nodes completed",
            "id": "gs-gate-4",
            "predicate": {
              "condition": "status.state == done",
              "kind": "all-of",
              "query": {
                "level": "required",
                "phase": "getting-started"
              }
            }
          }
        ],
        "id": "getting-started-gate",
        "outcomes": [
          "pass",
          "fix_forward",
          "rollback"
        ],
        "purpose": "Foundational architecture decisions validated"
      },
      "id": "getting-started",
      "nodes": [
        {
          "decision_input": {
            "help": "Python: {service}_mcp, Node: {service}-mcp-server",
            "label": "Server Name",
            "pattern": "^[a-z0-9_-]+$",
            "placeholder": "analytics_mcp"
          },
          "door": "one_way",
          "effort": {
            "confidence": "high",
            "max": 20,
            "min": 15
          },
          "evidence_policy": [
            {
              "criteria": "Validate naming pattern across ecosystem examples",
              "required_at": "gate",
              "type": "spike"
            }
          ],
          "id": "server-naming",
          "level": "required",
          "status": {
            "state": "todo"
          },
          "summary": "Decide on naming convention: Python uses {service}_mcp, Node uses {service}-mcp-server",
          "tags": [
            "naming",
            "architecture"
          ],
          "title": "Choose server naming pattern",
          "why": "Consistent discoverability across ecosystem; avoid feature/version coupling"
        },
        {
          "door": "one_way",
          "effort": {
            "confidence": "medium",
            "max": 45,
            "min": 25
          },
          "evidence_policy": [
            {
              "criteria": "Prototype transport mechanism with MCP SDK",
              "required_at": "gate",
              "type": "spike"
            }
          ],
          "id": "transport-selection",
          "level": "required",
          "status": {
            "state": "todo"
          },
          "summary": "Choose stdio (local/CLI), HTTP (remote/multi-client), or SSE (real-time updates)",
          "tags": [
            "architecture",
            "transport"
          ],
          "title": "Select transport mechanism",
          "why": "Transport choice affects deployment complexity and scalability"
        },
        {
          "blocks": [
            {
              "on": "server-naming",
              "reason": "Server name must be chosen first to derive tool prefix"
            }
          ],
          "door": "one_way",
          "effort": {
            "confidence": "high",
            "max": 20,
            "min": 10
          },
          "evidence_policy": [
            {
              "criteria": "Define naming pattern with examples",
              "required_at": "gate",
              "type": "spike"
            }
          ],
          "id": "tool-naming",
          "level": "required",
          "status": {
            "state": "todo"
          },
          "summary": "Use snake_case with service prefix, start with verbs (get/list/create)",
          "tags": [
            "naming",
            "tooling"
          ],
          "title": "Define tool naming conventions",
          "why": "Avoid cross-server collisions and provide predictable intent"
        }
      ],
      "title": "Getting Started"
    },
    {
      "color": "#10B981",
      "description": "Essential functionality and tool implementation",
      "gate": {
        "applies_to": "phase",
        "approvers": [
          "SA",
          "DEV"
        ],
        "checks": [
          {
            "description": "Contract defined for all design nodes",
            "id": "cf-gate-1",
            "predicate": {
              "condition": "has_contract",
              "kind": "all-of",
              "query": {
                "level": "required",
                "phase": "core-features",
                "tags": [
                  "tooling"
                ]
              }
            }
          },
          {
            "description": "Input validation guardrail has passing security evidence",
            "id": "cf-gate-2",
            "predicate": {
              "evidence_type": "security",
              "kind": "evidence-meets",
              "result": "meets",
              "target": "input-validation"
            }
          },
          {
            "description": "All implementation nodes have passing tests",
            "id": "cf-gate-3",
            "predicate": {
              "condition": "has_evidence:test_report",
              "kind": "all-of",
              "query": {
                "level": "required",
                "phase": "core-features"
              }
            }
          },
          {
            "description": "All required nodes completed",
            "id": "cf-gate-4",
            "predicate": {
              "condition": "status.state == done",
              "kind": "all-of",
              "query": {
                "level": "required",
                "phase": "core-features"
              }
            }
          }
        ],
        "id": "core-features-gate",
        "outcomes": [
          "pass",
          "fix_forward",
          "rollback"
        ],
        "purpose": "Essential functionality implemented and tested"
      },
      "id": "core-features",